{"$schema":"https://json-schema.org/draft/2020-12/schema","$id":"https://github.com/Kajin-0/MCT-Device/schemas/mct_provenance_bundle.schema.json","title":"MCT-Device digital provenance bundle","description":"Round-48 structural schema. Cross-record semantic invariants are enforced by tools/validate_mct_provenance.py.","type":"object","additionalProperties":false,"properties":{"schema_version":{"const":"mct-provenance-1.0.0"},"bundle_id":{"type":"string","pattern":"^[A-Z0-9][A-Z0-9._:-]*$"},"created_at":{"type":"string","format":"date-time"},"mode":{"enum":["SYNTHETIC","LAB"]},"records":{"type":"array","minItems":1,"items":{"oneOf":[{"$ref":"#/$defs/material_node"},{"$ref":"#/$defs/process_event"},{"$ref":"#/$defs/measurement"},{"$ref":"#/$defs/configuration"},{"$ref":"#/$defs/calibration"},{"$ref":"#/$defs/gate_decision"},{"$ref":"#/$defs/holdout_lock"},{"$ref":"#/$defs/reserve_lock"},{"$ref":"#/$defs/reserve_release"},{"$ref":"#/$defs/model_freeze"},{"$ref":"#/$defs/access_event"},{"$ref":"#/$defs/deviation_rework"},{"$ref":"#/$defs/evidence_promotion"},{"$ref":"#/$defs/audit_event"}]}}},"required":["schema_version","bundle_id","created_at","mode","records"],"$defs":{"data_ref":{"type":"object","additionalProperties":false,"properties":{"uri":{"type":"string","minLength":1},"sha256":{"type":"string","pattern":"^[0-9a-f]{64}$"}},"required":["uri","sha256"]},"material_node":{"type":"object","additionalProperties":false,"properties":{"id":{"type":"string","minLength":3,"pattern":"^[A-Z0-9][A-Z0-9._:-]*$"},"record_type":{"const":"material_node"},"created_at":{"type":"string","format":"date-time"},"revision":{"type":"integer","minimum":1},"synthetic":{"type":"boolean"},"physical_object_id":{"type":"string","minLength":1},"parent_node_ids":{"type":"array","items":{"type":"string"},"uniqueItems":true},"root_node_id":{"type":"string"},"state_time":{"type":"string","format":"date-time"},"state_label":{"type":"string","minLength":1},"roles":{"type":"array","items":{"type":"string"},"uniqueItems":true},"experimental_unit_id":{"type":["string","null"]},"terminal":{"type":"boolean"}},"required":["id","record_type","created_at","revision","synthetic","physical_object_id","parent_node_ids","root_node_id","state_time","state_label","roles","terminal"]},"process_event":{"type":"object","additionalProperties":false,"properties":{"id":{"type":"string","minLength":3,"pattern":"^[A-Z0-9][A-Z0-9._:-]*$"},"record_type":{"const":"process_event"},"created_at":{"type":"string","format":"date-time"},"revision":{"type":"integer","minimum":1},"synthetic":{"type":"boolean"},"event_class":{"enum":["LPE","ANNEAL","RIE","PASSIVATION","LITHOGRAPHY","METALLIZATION","SINGULATION","PACKAGE","REWORK","HANDLING","OTHER"]},"procedure_ref":{"type":"string"},"input_node_ids":{"type":"array","items":{"type":"string"},"minItems":1,"uniqueItems":true},"output_node_ids":{"type":"array","items":{"type":"string"},"minItems":1,"uniqueItems":true},"configuration_ids":{"type":"array","items":{"type":"string"},"uniqueItems":true},"calibration_ids":{"type":"array","items":{"type":"string"},"uniqueItems":true},"started_at":{"type":"string","format":"date-time"},"ended_at":{"type":"string","format":"date-time"},"execution_status":{"enum":["VALID","INVALID","DEVIATION"]},"irreversible":{"type":"boolean"},"state_changing":{"type":"boolean"},"lineage_mode":{"enum":["STATE_TRANSITION","SPLIT"]}},"required":["id","record_type","created_at","revision","synthetic","event_class","procedure_ref","input_node_ids","output_node_ids","configuration_ids","calibration_ids","started_at","ended_at","execution_status","irreversible","state_changing","lineage_mode"]},"measurement":{"type":"object","additionalProperties":false,"properties":{"id":{"type":"string","minLength":3,"pattern":"^[A-Z0-9][A-Z0-9._:-]*$"},"record_type":{"const":"measurement"},"created_at":{"type":"string","format":"date-time"},"revision":{"type":"integer","minimum":1},"synthetic":{"type":"boolean"},"node_id":{"type":"string"},"method_ref":{"type":"string"},"configuration_ids":{"type":"array","items":{"type":"string"},"uniqueItems":true},"calibration_ids":{"type":"array","items":{"type":"string"},"uniqueItems":true},"acquired_at":{"type":"string","format":"date-time"},"qc_status":{"enum":["PASS","HOLD","FAIL","INVALID"]},"result_fields":{"type":"array","items":{"type":"string"},"uniqueItems":true},"raw_data_refs":{"type":"array","items":{"$ref":"#/$defs/data_ref"},"minItems":1},"analysis_ref":{"type":["string","null"]}},"required":["id","record_type","created_at","revision","synthetic","node_id","method_ref","configuration_ids","calibration_ids","acquired_at","qc_status","result_fields","raw_data_refs"]},"configuration":{"type":"object","additionalProperties":false,"properties":{"id":{"type":"string","minLength":3,"pattern":"^[A-Z0-9][A-Z0-9._:-]*$"},"record_type":{"const":"configuration"},"created_at":{"type":"string","format":"date-time"},"revision":{"type":"integer","minimum":1},"synthetic":{"type":"boolean"},"config_class":{"type":"string"},"version_label":{"type":"string"},"status":{"enum":["ACTIVE","SUPERSEDED","RETIRED"]},"valid_from":{"type":"string","format":"date-time"},"valid_to":{"type":["string","null"],"format":"date-time"},"supersedes_id":{"type":["string","null"]}},"required":["id","record_type","created_at","revision","synthetic","config_class","version_label","status","valid_from","valid_to","supersedes_id"]},"calibration":{"type":"object","additionalProperties":false,"properties":{"id":{"type":"string","minLength":3,"pattern":"^[A-Z0-9][A-Z0-9._:-]*$"},"record_type":{"const":"calibration"},"created_at":{"type":"string","format":"date-time"},"revision":{"type":"integer","minimum":1},"synthetic":{"type":"boolean"},"configuration_id":{"type":"string"},"scope":{"type":"string"},"status":{"enum":["VALID","INVALIDATED","EXPIRED"]},"valid_from":{"type":"string","format":"date-time"},"valid_to":{"type":["string","null"],"format":"date-time"}},"required":["id","record_type","created_at","revision","synthetic","configuration_id","scope","status","valid_from","valid_to"]},"gate_decision":{"type":"object","additionalProperties":false,"properties":{"id":{"type":"string","minLength":3,"pattern":"^[A-Z0-9][A-Z0-9._:-]*$"},"record_type":{"const":"gate_decision"},"created_at":{"type":"string","format":"date-time"},"revision":{"type":"integer","minimum":1},"synthetic":{"type":"boolean"},"gate_code":{"enum":["G0","G1","G2","G3","G4","G5","G6","G7","G8"]},"node_id":{"type":["string","null"]},"proposed_operation":{"type":"string"},"evaluated_at":{"type":"string","format":"date-time"},"prerequisite_record_ids":{"type":"array","items":{"type":"string"},"uniqueItems":true},"configuration_ids":{"type":"array","items":{"type":"string"},"uniqueItems":true},"calibration_ids":{"type":"array","items":{"type":"string"},"uniqueItems":true},"technical_status":{"enum":["PASS","HOLD","FAIL"]},"material_status":{"enum":["PASS","HOLD","FAIL"]},"decision":{"enum":["GO","HOLD","REWORK","STOP"]},"release_scope":{"type":"string"},"reviewer_ids":{"type":"array","items":{"type":"string"},"minItems":1},"prerequisite_assertions":{"type":"array","items":{"$ref":"#/$defs/prerequisite_assertion"},"minItems":1}},"required":["id","record_type","created_at","revision","synthetic","gate_code","node_id","proposed_operation","evaluated_at","prerequisite_record_ids","configuration_ids","calibration_ids","technical_status","material_status","decision","release_scope","reviewer_ids","prerequisite_assertions"]},"holdout_lock":{"type":"object","additionalProperties":false,"properties":{"id":{"type":"string","minLength":3,"pattern":"^[A-Z0-9][A-Z0-9._:-]*$"},"record_type":{"const":"holdout_lock"},"created_at":{"type":"string","format":"date-time"},"revision":{"type":"integer","minimum":1},"synthetic":{"type":"boolean"},"node_id":{"type":"string"},"campaign":{"type":"string"},"protected_model_key":{"type":"string"},"protected_response_fields":{"type":"array","items":{"type":"string"},"minItems":1,"uniqueItems":true},"locked_at":{"type":"string","format":"date-time"},"state":{"enum":["LOCKED","CONSUMED","RETIRED"]},"replacement_rule":{"type":"string"},"model_freeze_id":{"type":["string","null"]}},"required":["id","record_type","created_at","revision","synthetic","node_id","campaign","protected_model_key","protected_response_fields","locked_at","state","replacement_rule","model_freeze_id"]},"reserve_lock":{"type":"object","additionalProperties":false,"properties":{"id":{"type":"string","minLength":3,"pattern":"^[A-Z0-9][A-Z0-9._:-]*$"},"record_type":{"const":"reserve_lock"},"created_at":{"type":"string","format":"date-time"},"revision":{"type":"integer","minimum":1},"synthetic":{"type":"boolean"},"node_ids":{"type":"array","items":{"type":"string"},"minItems":1,"uniqueItems":true},"purpose":{"type":"string"},"locked_at":{"type":"string","format":"date-time"},"release_trigger_key":{"type":"string","minLength":1},"release_trigger_description":{"type":"string","minLength":1}},"required":["id","record_type","created_at","revision","synthetic","node_ids","purpose","locked_at","release_trigger_key","release_trigger_description"]},"model_freeze":{"type":"object","additionalProperties":false,"properties":{"id":{"type":"string","minLength":3,"pattern":"^[A-Z0-9][A-Z0-9._:-]*$"},"record_type":{"const":"model_freeze"},"created_at":{"type":"string","format":"date-time"},"revision":{"type":"integer","minimum":1},"synthetic":{"type":"boolean"},"model_key":{"type":"string"},"model_revision":{"type":"string"},"campaign":{"type":"string"},"frozen_at":{"type":"string","format":"date-time"},"training_measurement_ids":{"type":"array","items":{"type":"string"},"uniqueItems":true},"holdout_lock_ids":{"type":"array","items":{"type":"string"},"minItems":1,"uniqueItems":true},"model_digest_sha256":{"type":"string","pattern":"^[0-9a-f]{64}$"}},"required":["id","record_type","created_at","revision","synthetic","model_key","model_revision","campaign","frozen_at","training_measurement_ids","holdout_lock_ids","model_digest_sha256"]},"access_event":{"type":"object","additionalProperties":false,"properties":{"id":{"type":"string","minLength":3,"pattern":"^[A-Z0-9][A-Z0-9._:-]*$"},"record_type":{"const":"access_event"},"created_at":{"type":"string","format":"date-time"},"revision":{"type":"integer","minimum":1},"synthetic":{"type":"boolean"},"holdout_lock_id":{"type":"string"},"access_type":{"enum":["QC","OUTCOME"]},"accessed_at":{"type":"string","format":"date-time"},"fields":{"type":"array","items":{"type":"string"},"minItems":1,"uniqueItems":true},"model_freeze_id":{"type":["string","null"]}},"required":["id","record_type","created_at","revision","synthetic","holdout_lock_id","access_type","accessed_at","fields","model_freeze_id"]},"deviation_rework":{"type":"object","additionalProperties":false,"properties":{"id":{"type":"string","minLength":3,"pattern":"^[A-Z0-9][A-Z0-9._:-]*$"},"record_type":{"const":"deviation_rework"},"created_at":{"type":"string","format":"date-time"},"revision":{"type":"integer","minimum":1},"synthetic":{"type":"boolean"},"node_id":{"type":"string"},"deviation_class":{"enum":["MEASUREMENT_INVALIDITY","HANDLING_DAMAGE","PROCESS_EXCURSION","TRUE_TREATMENT_RESPONSE","GENEALOGY_ERROR","CONFIGURATION_CHANGE","UNKNOWN"]},"detected_at":{"type":"string","format":"date-time"},"disposition":{"enum":["HOLD","REWORK","STOP","CONTINUE"]},"state_changing":{"type":"boolean"},"rework_process_event_id":{"type":["string","null"]},"reassigned_role_node_id":{"type":["string","null"]},"equivalence_approval_id":{"type":["string","null"]}},"required":["id","record_type","created_at","revision","synthetic","node_id","deviation_class","detected_at","disposition","state_changing","rework_process_event_id","reassigned_role_node_id","equivalence_approval_id"]},"evidence_promotion":{"type":"object","additionalProperties":false,"properties":{"id":{"type":"string","minLength":3,"pattern":"^[A-Z0-9][A-Z0-9._:-]*$"},"record_type":{"const":"evidence_promotion"},"created_at":{"type":"string","format":"date-time"},"revision":{"type":"integer","minimum":1},"synthetic":{"type":"boolean"},"quantity_id":{"type":"string"},"from_state":{"enum":["EMPIRICAL-REQUIRED","DESIGN-IDENTIFIED","DESIGN-RESOLUTION-VERIFIED","EMPIRICAL-PRELIMINARY","EMPIRICAL-VERIFIED","DETECTOR-BRIDGED"]},"to_state":{"enum":["DESIGN-IDENTIFIED","DESIGN-RESOLUTION-VERIFIED","EMPIRICAL-PRELIMINARY","EMPIRICAL-VERIFIED","DETECTOR-BRIDGED","ALLOCATION-ELIGIBLE"]},"promoted_at":{"type":"string","format":"date-time"},"model_freeze_id":{"type":["string","null"]},"holdout_lock_ids":{"type":"array","items":{"type":"string"},"uniqueItems":true},"holdout_result":{"enum":["PASS","FAIL","INVALID","NOT_REQUIRED"]},"g8_gate_id":{"type":"string"},"uncertainty_ref":{"type":["string","null"]},"valid_range_ref":{"type":["string","null"]},"detector_bridge_ref":{"type":["string","null"]}},"required":["id","record_type","created_at","revision","synthetic","quantity_id","from_state","to_state","promoted_at","model_freeze_id","holdout_lock_ids","holdout_result","g8_gate_id","uncertainty_ref","valid_range_ref","detector_bridge_ref"]},"audit_event":{"type":"object","additionalProperties":false,"properties":{"id":{"type":"string","minLength":3,"pattern":"^[A-Z0-9][A-Z0-9._:-]*$"},"record_type":{"const":"audit_event"},"created_at":{"type":"string","format":"date-time"},"revision":{"type":"integer","minimum":1},"synthetic":{"type":"boolean"},"target_record_ids":{"type":"array","items":{"type":"string"},"minItems":1,"uniqueItems":true},"action":{"enum":["CREATE","REVIEW","APPROVE","INVALIDATE","SIGN"]},"actor_id":{"type":"string"},"role":{"type":"string"},"at":{"type":"string","format":"date-time"},"digest_sha256":{"type":"string","pattern":"^[0-9a-f]{64}$"}},"required":["id","record_type","created_at","revision","synthetic","target_record_ids","action","actor_id","role","at","digest_sha256"]},"prerequisite_assertion":{"type":"object","additionalProperties":false,"properties":{"key":{"type":"string","minLength":1},"status":{"enum":["PASS","HOLD","FAIL"]},"evidence_record_ids":{"type":"array","items":{"type":"string"},"minItems":1,"uniqueItems":true}},"required":["key","status","evidence_record_ids"]},"reserve_release":{"type":"object","additionalProperties":false,"properties":{"id":{"type":"string","minLength":3,"pattern":"^[A-Z0-9][A-Z0-9._:-]*$"},"record_type":{"const":"reserve_release"},"created_at":{"type":"string","format":"date-time"},"revision":{"type":"integer","minimum":1},"synthetic":{"type":"boolean"},"reserve_lock_id":{"type":"string"},"released_at":{"type":"string","format":"date-time"},"trigger_key":{"type":"string","minLength":1},"basis_record_ids":{"type":"array","items":{"type":"string"},"minItems":1,"uniqueItems":true},"reviewer_ids":{"type":"array","items":{"type":"string"},"minItems":1}},"required":["id","record_type","created_at","revision","synthetic","reserve_lock_id","released_at","trigger_key","basis_record_ids","reviewer_ids"]}}}
